{"schemaVersion":"forge.m4.fixture-case/v1","caseId":"action-not-completed-with-oracle-performed","base":"action_not_completed","operations":[{"op":"replace","path":"/oracle","value":{"outcome":"mismatched","oracleAuthority":{"kind":"subject_observable","subjectId":"subject-checkout"},"expected":"/checkout-step-one.html","actual":"/wrong.html"}}],"expected":{"stage":"classification","kind":"refusal","code":"integrity_invalid"}}
