{"schemaVersion":"forge.m4.fixture-case/v1","caseId":"oracle-mismatch-causal-field","base":"oracle_mismatch","operations":[],"assertedOutcome":{"schemaVersion":"forge.m4.diagnostic-outcome/v1","evidenceSchemaVersion":"forge.m4.diagnostic-evidence/v1","classifierVersion":"forge.m4.diagnostic-classifier/v1","evidenceHash":"4444444444444444444444444444444444444444444444444444444444444444","kind":"classified_failure","failureMode":"oracle_mismatch","explanationCode":"governed_oracle_mismatch","explanationParameters":{"subjectId":"subject-checkout","expectedRoute":"/checkout-step-one.html","actualRoute":"/wrong.html"},"rootCause":"application_defect"},"expected":{"stage":"outcome_schema_rejected"}}
