{"schemaVersion":"forge.m4.fixture-case/v1","caseId":"target-not-observed-with-action-attempted","base":"target_not_observed","operations":[{"op":"replace","path":"/action","value":{"outcome":"not_completed","interactionAttempted":true,"semantic":"click_observed_data_test","failureClass":"interaction_failed"}}],"expected":{"stage":"classification","kind":"refusal","code":"integrity_invalid"}}
