{"schemaVersion":"forge.m4.fixture-case/v1","caseId":"auth-root-cause-overclaim","base":"authentication_not_established","operations":[],"assertedOutcome":{"schemaVersion":"forge.m4.diagnostic-outcome/v1","evidenceSchemaVersion":"forge.m4.diagnostic-evidence/v1","classifierVersion":"forge.m4.diagnostic-classifier/v1","evidenceHash":"9999999999999999999999999999999999999999999999999999999999999999","kind":"classified_failure","failureMode":"bad_credentials","explanation":"The credentials were wrong."},"expected":{"stage":"outcome_schema_rejected"}}
