{"schemaVersion":"forge.m4.fixture-case/v1","caseId":"historical-current-head-leakage","base":"oracle_mismatch","operations":[{"op":"replace","path":"/authority/acceptedDefinitionAuthority","value":{"definitionSchemaVersion":3,"testSetId":"test-set-product-owned","testSetRevision":8,"testSetContentHash":"2222222222222222222222222222222222222222222222222222222222222222","definitionId":"definition-product-owned","definitionContentHash":"3333333333333333333333333333333333333333333333333333333333333333","supportSealHash":"4444444444444444444444444444444444444444444444444444444444444444","routeEvidenceIdentityHash":"5555555555555555555555555555555555555555555555555555555555555555","authenticationExpectationIdentityHash":"6666666666666666666666666666666666666666666666666666666666666666","snapshotHash":"7777777777777777777777777777777777777777777777777777777777777777"}}],"expected":{"stage":"classification","kind":"refusal","code":"integrity_invalid"}}
