{"schemaVersion":"forge.m4.fixture-case/v1","caseId":"selector-drift-overclaim","base":"target_not_observed","operations":[],"assertedOutcome":{"schemaVersion":"forge.m4.diagnostic-outcome/v1","evidenceSchemaVersion":"forge.m4.diagnostic-evidence/v1","classifierVersion":"forge.m4.diagnostic-classifier/v1","evidenceHash":"8888888888888888888888888888888888888888888888888888888888888888","kind":"classified_failure","failureMode":"selector_drift","explanation":"The selector drifted."},"expected":{"stage":"outcome_schema_rejected"}}
